atype,date,lead_par,url,word_count
Interactive Feature,2018-01-01,,https://www.nytimes.com/interactive/2017/12/31/business/A-Big-Year-for-the-Stock-Market.html,0
News,2018-01-01,Here’s what to expect in the week ahead:,https://www.nytimes.com/2017/12/31/business/start-of-a-new-year-of-trading-and-jobs-report-from-december.html,292
News,2018-01-01,"The chief executive of the world’s biggest catering company, which is also one of Britain’s biggest businesses, died on Sunday in a plane crash near Sydney, the Australian police said.",https://www.nytimes.com/2018/01/01/business/sydney-compass-richard-cousins.html,544
News,2018-01-01,"LOS ANGELES — In late summer, Verizon Communications came to Rupert Murdoch with a surprise acquisition offer.",https://www.nytimes.com/2018/01/01/business/media/rupert-murdoch-21st-century-fox-disney.html,1690
News,2018-01-01,"Airlines have been shrinking their seats for a long time, aiming to reduce the planes’ weight and squeeze in more passengers. But lately, some carriers have been going one step further in redesigning their seats: They’re taking away the seatback screens.",https://www.nytimes.com/2018/01/01/business/airlines-travel-entertainment.html,1042
News,2018-01-01,COPENHAGEN — A Danish biotechnology company is trying to fight climate change — one laundry load at a time. Its secret weapon: mushrooms like those in a dormant forest outside Copenhagen.,https://www.nytimes.com/2018/01/01/business/energy-environment/climate-change-enzymes-laundry.html,1071
News,2018-01-02,Please take your seats.,https://www.nytimes.com/2018/01/01/business/dealbook/biggest-deals-2017.html,1421
News,2018-01-02,"Gretchen Carlson, who was Miss America in 1989 and in recent years has become a prominent voice against workplace sexual harassment, will take over as chairwoman of the pageant’s board of directors, the organization announced on Monday.",https://www.nytimes.com/2018/01/01/business/gretchen-carlson-miss-america.html,495
News,2018-01-02,"Hoda Kotb, the longtime co-host of the fourth hour of the NBC morning franchise “Today,” will replace Matt Lauer as co-anchor of the program’s opening hours, the network said on Tuesday.",https://www.nytimes.com/2018/01/02/business/media/hoda-kotb-today-matt-lauer.html,811
News,2018-01-02,Good Tuesday and happy new year!,https://www.nytimes.com/2018/01/02/business/dealbook/2018-business-trump.html,3229
News,2018-01-02,A YouTube star with millions of followers apologized on Monday for posting a video that showed a dead body hanging from a tree in a Japanese forest known as a destination for suicide victims.,https://www.nytimes.com/2018/01/02/business/media/logan-paul-youtube.html,714
News,2018-01-02,"HONG KONG — One of the world’s most valuable start-ups got that way by using artificial intelligence to satisfy Chinese internet users’ voracious appetite for news and entertainment. Every day, its smartphone app feeds 120 million people personalized streams of buzzy news stories, videos of dogs frolicking in snow, GIFs of traffic mishaps and listicles such as “The World’s Ugliest Celebrities.”",https://www.nytimes.com/2018/01/02/business/china-toutiao-censorship.html,1135
Interactive Feature,2018-01-02,A successful career requires managing the person in the mirror – overcoming your tendencies and habits that can undermine efforts to find happiness at work. Here’s how to do that.,https://www.nytimes.com/interactive/2018/business/guide-manage-career.html,0
News,2018-01-02,"SALT LAKE CITY — More than three years after construction was started to rebuild Salt Lake City International Airport and scrape away a collection of obsolete terminals, the contours of one of the nation’s largest air travel infrastructure projects are taking shape.",https://www.nytimes.com/2018/01/02/business/salt-lake-city-airport-renovation.html,1138
News,2018-01-02,"Vice Media placed its president, Andrew Creighton, and its chief digital officer, Mike Germano, on leave after sexual harassment allegations were reported against them in a New York Times investigation that detailed the treatment of women at the company.",https://www.nytimes.com/2018/01/02/business/vice-media-executives-on-leave.html,610
News,2018-01-02,"The golden age of television programming is heading for a grisly finale. Netflix, Amazon, Apple and Hulu are on course to increase their spending on new shows and movies at a faster clip than the growth of the overall video-streaming market. Consolidation among traditional media groups is only adding to the frenzy. Something will have to give.",https://www.nytimes.com/2018/01/02/business/dealbook/tv-content-streaming.html,408
News,2018-01-03,"The Showtime political documentary series “The Circus” is set to return in April, minus its most recognizable star: Mark Halperin, the high-flying journalist whose career was felled last year by allegations of sexual harassment and sexual assault.",https://www.nytimes.com/2018/01/02/business/media/showtime-the-circus-halperin.html,856
News,2018-01-03,SHANGHAI — One new drug promises to stop cancer from spreading to other organs. Another would treat blood cancer. A third would use the body’s immune system to kill tumors.,https://www.nytimes.com/2018/01/03/business/china-drugs-health-care.html,1204
News,2018-01-03,Good Wednesday. Here’s what we’re watching:,https://www.nytimes.com/2018/01/03/business/dealbook/ant-financial-moneygram-trump.html,3192
News,2018-01-03,"Petróleo Brasileiro, Brazil’s state-controlled oil company, said on Wednesday that it had agreed to pay $2.95 billion to settle a shareholder lawsuit in the United States over a corruption scandal that has ensnared dozens of politicians and corporate executives, including two former Brazilian presidents.",https://www.nytimes.com/2018/01/03/business/dealbook/brazil-petrobras-corruption-scandal.html,638
News,2018-01-03,"Homeowners, businesses and utilities across much of the United States were keeping a close watch on fuel supplies Wednesday as a record-setting cold snap caused demand for heating oil and natural gas to soar.",https://www.nytimes.com/2018/01/03/business/heating-homeowners-winter.html,1020
News,2018-01-03,WASHINGTON — The Federal Reserve has entered 2018 without a clear plan for raising its benchmark interest rate and with the added uncertainty of an imminent change in its leadership.,https://www.nytimes.com/2018/01/03/business/economy/fed-rate-increases.html,908
News,2018-01-03,The auto industry’s long-running sales party has come to an end.,https://www.nytimes.com/2018/01/03/business/auto-sales.html,880
News,2018-01-03,Spotify is finally ready to go public.,https://www.nytimes.com/2018/01/03/business/media/spotify-ipo-streaming-music.html,808
News,2018-01-03,"From the surging value of cryptocurrencies to the continuing investigation of Russian interference in the 2016 presidential election, developments in 2017 were hard to forecast. Who could have predicted that an article in The New York Times in October describing sexual misconduct by the movie mogul Harvey Weinstein would unleash a torrent of claims about media stars, members of Congress and the judiciary and even an N.F.L. owner?",https://www.nytimes.com/2018/01/03/business/dealbook/bitcoin-russia-investigation.html,1015
News,2018-01-03,The big corporate tax break that became law last month is great news for companies and their investors. But what about employees? How much of the corporate tax windfall will go to workers via higher wages? ,https://www.nytimes.com/2018/01/03/business/corporate-tax-cut-bonuses-employees.html,730
News,2018-01-04,Tesla’s first mass-market offering keeps encountering roadblocks.,https://www.nytimes.com/2018/01/03/business/tesla-model-3.html,490
News,2018-01-04,Good Thursday. (We hope that all U.S.-based readers are staying warm.) Here’s what we’re watching:,https://www.nytimes.com/2018/01/04/business/dealbook/trump-bannon-wolff-book.html,2945
News,2018-01-04,"SHANGHAI — China’s biggest online payment company offers its hundreds of millions of users a breakdown on their spending each year, showing everything from their environmental impact to their ranking among shoppers in their area. Many spenders — not shy, and occasionally even a bit boastful about their personal finances — in turn share the details on social media.",https://www.nytimes.com/2018/01/04/business/china-alibaba-privacy.html,1290
News,2018-01-04,"The Dow Jones industrial average on Thursday closed above 25,000 points for the first time, setting a record for the 132-year-old index.",https://www.nytimes.com/2018/01/04/business/dealbook/dow-25000.html,184
News,2018-01-04,It will sound like bad news.,https://www.nytimes.com/2018/01/04/business/corporate-tax-cuts.html,1122
News,2018-01-04,"Sales of electric and hybrid cars in Norway outpaced those running on fossil fuels last year, cementing the country’s position as a global leader in the push to restrict vehicle emissions.",https://www.nytimes.com/2018/01/04/business/energy-environment/norway-electric-hybrid-cars.html,785
News,2018-01-04,"Newsroom employees at The Los Angeles Times began casting ballots Thursday on whether to form a union, in what they believe is the first time journalists have held a union vote in the newspaper’s 136-year history.",https://www.nytimes.com/2018/01/04/business/media/los-angeles-times-union-vote.html,869
News,2018-01-04,"In the midst of a long-running bull market that is now reaching momentous proportions, most investors may well have forgotten that just two years ago, during the first five trading days of 2016, the market dropped 6 percent. It was the worst five-day start to a year ever and supposedly a harbinger of bad times.",https://www.nytimes.com/2018/01/04/business/market-dow-2018.html,1406
News,2018-01-04,"PASADENA, Calif. — A top Fox TV executive said she was “shocked” when the deal between 21st Century Fox and the Walt Disney Company was announced. One of Fox’s most prolific hitmakers, Ryan Murphy, said he was “very emotional” and weighing whether he would stick around when his deal with the studio ended later this year.",https://www.nytimes.com/2018/01/04/business/media/ryan-murphy-fox-disney.html,740
News,2018-01-05,"Michael Wolff has, for years, been a prime piranha in the Manhattan media pond, using his caustic columns to tear into his lunchmates at Michael’s, the Midtown mogul canteen, and cutting a memorable figure at star-speckled dinner parties, clad in Charvet ties and shirts by the London haberdashery Browns.",https://www.nytimes.com/2018/01/04/business/media/michael-wolff-trump.html,1154
News,2018-01-05,The former publisher of The Anniston Star in Alabama resigned on Thursday as chairman of the company that owns the newspaper after admitting that he spanked a reporter in the 1970s.,https://www.nytimes.com/2018/01/04/business/media/alabama-newspaper-spanking.html,460
News,2018-01-05,The bustling United States economy is beginning to benefit some American workers who have not gotten a taste of the recovery and have been most in need of relief.,https://www.nytimes.com/2018/01/05/business/economy/jobs-report.html,1284
News,2018-01-05,Good Friday. Here’s what we’re watching:,https://www.nytimes.com/2018/01/05/business/dealbook/dow-25000-markets.html,3041
News,2018-01-05,The author of a scathing new book about President Trump said on Friday that the president’s attempt to block its publication would not only help with sales but would also confirm the book’s key finding: Mr. Trump is unfit for office.,https://www.nytimes.com/2018/01/05/business/media/michael-wolff-trump-today.html,637
News,2018-01-05,"In the 1950s, a pack of Camels could be had for as little as 25 cents in some parts of the country. But in New York City today, heavy taxes have pushed that price north of $13. Even adjusted for inflation, that’s more than a fivefold increase.",https://www.nytimes.com/2018/01/05/business/economy/why-even-tougher-regulations-on-smoking-are-justified.html,975
News,2018-01-05,"PASADENA, Calif. — Too many TV shows to choose from?",https://www.nytimes.com/2018/01/05/business/media/487-original-programs-aired-in-2017.html,637
News,2018-01-05,"Robert S. Khuzami, who led the enforcement division of the Securities and Exchange Commission for four years during the Obama administration, was named on Friday as the deputy United States attorney in Manhattan.",https://www.nytimes.com/2018/01/05/business/robert-khuzami-us-attorneys-office.html,519
News,2018-01-07,"Last May, Jared Kushner accompanied President Trump, his father-in-law, on the pair’s first diplomatic trip to Israel, part of Mr. Kushner’s White House assignment to achieve peace in the Middle East.",https://www.nytimes.com/2018/01/07/business/jared-kushner-israel.html,1380
News,2018-01-08,"Pamela Anderson walks down a city street and uses her cellphone to book a ride. Along the way, she passes a newspaper and street signs that say, “Hollywood Sexual Harassment Scandal Reaches New Lows” and “U.S. Senator Accused of Groping.” When she gets into the car, she sees another sign that says, “Ride-Hail Drivers Suspected of Rape.” The car doors lock, and the driver turns around and suggestively asks, “Shall we?” Just then, “#MeToo” pops up on her phone’s screen.",https://www.nytimes.com/2018/01/07/business/media/uber-lyft-ad.html,828
News,2018-01-08,"In the weeks after Stephen K. Bannon’s ouster from the Trump White House last August, his flagship organization Breitbart News verged, at times, on a Bannon vanity project.",https://www.nytimes.com/2018/01/07/business/media/steve-bannon-breitbart.html,954
News,2018-01-08,A senior editor for BBC News accused the network in an open letter on Sunday of operating a “secretive and illegal” salary system that pays men more than women in similar positions.,https://www.nytimes.com/2018/01/07/business/media/bbc-gender-pay-gap.html,655
News,2018-01-08,Here’s what to expect in the week ahead:,https://www.nytimes.com/2018/01/07/business/inflation-consumer-tech-earnings.html,583
News,2018-01-08,Good Monday. Here’s what we’re watching:,https://www.nytimes.com/2018/01/08/business/dealbook/intel-ceo-security.html,3331
News,2018-01-08,"When Samantha Barry was growing up in Ireland, she and her family would gather around the television to watch the 6 o’clock news. They also told stories around the dinner table and read a number of newspapers and magazines, including Vogue and old issues of Time.",https://www.nytimes.com/2018/01/08/business/media/conde-nast-glamour-editor.html,949
News,2018-01-08,"LANZHOU, China — Feng Gang stood in front of 150 people in a conference hall in Beijing that Amway, the American marketing giant, calls its flagship “experience center.”",https://www.nytimes.com/2018/01/08/business/amway-china.html,1634
News,2018-01-08,"LONDON — The journalist who resigned as the BBC’s China editor to protest the broadcaster’s gender pay gap said on Monday that she was offered a raise before quitting, but one that still did not bring her to the level of her male peers.",https://www.nytimes.com/2018/01/08/business/media/bbc-carrie-gracie-china-editor.html,668
News,2018-01-08,A pair of investors who say they hold about $2 billion in Apple stock are pushing the company to do more to protect its youngest users from the effects of digital technology.,https://www.nytimes.com/2018/01/08/business/apple-investors-children.html,363
News,2018-01-08,"In Indiana, Missouri and Pennsylvania, President Trump used the same promise to sell the tax bill: It would bring jobs streaming back to struggling cities and towns.",https://www.nytimes.com/2018/01/08/business/economy/gop-says-tax-bill-will-add-jobs-in-us-it-may-yield-more-hiring-abroad.html,884
News,2018-01-09,"The tech backlash has caught up to Apple. The activist hedge fund Jana Partners and the California State Teachers’ Retirement System want Apple to give parents better controls over their children’s iPhones. It’s an unusual issue for an activist, and apps from Facebook and Snap would make better targets.",https://www.nytimes.com/2018/01/08/business/dealbook/tech-backlash-catches-up-to-apple.html,402
News,2018-01-09,"PASADENA, Calif. — Whether the reboot of the sitcom “Roseanne” will be a success for ABC remains an open question, but it will not be lacking in controversy.",https://www.nytimes.com/2018/01/08/business/media/roseanne-trump-abc.html,532
News,2018-01-09,Good Tuesday. Here’s what we’re watching:,https://www.nytimes.com/2018/01/09/business/dealbook/jana-apple-tech.html,2558
News,2018-01-09,"SHANGHAI — With an advanced screen, a special artificial-intelligence microchip and an eye-popping price, the newest smartphone from Huawei Technologies was meant to show Americans what China can do with technology.",https://www.nytimes.com/2018/01/09/business/att-huawei-mate-smartphone.html,855
News,2018-01-09,"PHNOM PENH, Cambodia — To sell real estate in Cambodia, agents are brushing up on their Mandarin.",https://www.nytimes.com/2018/01/09/business/cambodia-real-estate.html,1120
News,2018-01-09,"The journalist John Dickerson is a Washington creature to his core: a presidential historian, repository of political trivia and scion of a glamorous Beltway family whose party guests regularly included Kennedys, Johnsons and Reagans.",https://www.nytimes.com/2018/01/09/business/media/john-dickerson-charlie-rose-cbs-this-morning.html,695
News,2018-01-09,"FUJI, Japan — At a factory near the base of Mount Fuji, workers painstakingly assemble transmissions for some of the world’s top-selling cars. The expensive, complex components, and the workers’ jobs, could be obsolete in a couple of decades.",https://www.nytimes.com/2018/01/09/business/japan-electric-cars.html,1120
News,2018-01-09,"With labor unions seeing their influence wane, more than 200 organizations have sprouted nationwide to help low-wage workers. But nearly all these groups say they are hampered by a lack of dependable funding because, unlike unions, they cannot rely on a steady flow of dues.",https://www.nytimes.com/2018/01/09/business/economy/fast-food-labor.html,907
News,2018-01-09,"GoPro’s genius discount grows larger. The wearable-camera maker styled itself a media company when it went public in 2014, but even its hardware business is suffering job cuts as sales fall short. Success is even harder than usual when — as at Snap, which fancied itself a camera company — the boss wastes time and resources chasing whims.",https://www.nytimes.com/2018/01/09/business/dealbook/gopro-needs-to-know-its-limits.html,300
News,2018-01-09,"LOS ANGELES — Ending a power struggle in its senior ranks, Warner Bros. on Tuesday gave control of worldwide film production, marketing and distribution to Toby Emmerich, who rose through the studio by finding hits like “It” and shepherding “The Lord of the Rings” movies.",https://www.nytimes.com/2018/01/09/business/media/warner-bros-emmerich-kroll.html,482
News,2018-01-10,"What do you get when you cross the feverish world of cryptocurrencies and a faded industrial giant desperate for a new lease on life? The answer, provided Tuesday by Eastman Kodak, is KodakCoin.",https://www.nytimes.com/2018/01/09/business/dealbook/kodak-bitcoin.html,364
News,2018-01-10,The newly passed tax law could save Americans billions of dollars on their utility bills.,https://www.nytimes.com/2018/01/09/business/economy/tax-cut-power.html,794
News,2018-01-10,"Toyota Motor and Mazda Motor are expected to announce on Wednesday that they have chosen a location in northern Alabama, near Huntsville, for the $1.6 billion car plant the Japanese automakers are planning to build together, according to a person familiar with the companies’ plans.",https://www.nytimes.com/2018/01/09/business/toyota-mazda-alabama.html,328
News,2018-01-10,Good Wednesday morning. Here’s what we’re watching:,https://www.nytimes.com/2018/01/10/business/dealbook/buffett-berkshire-abel-jain.html,2298
News,2018-01-10,"Go to the gym and you will see them everywhere: the talking heads on CNN and Fox News, as ubiquitous as sports coverage in bars. But one fitness chain has cut them off, implying that cable news coverage is not conducive to a “healthy way of life.”",https://www.nytimes.com/2018/01/10/business/life-time-fitness-cable-news.html,831
News,2018-01-10,"When Treasury Secretary Steven Mnuchin was asked at his confirmation hearing what he thought about using private companies to collect money owed to the government, he replied that it “seems like a very obvious thing to do.”",https://www.nytimes.com/2018/01/10/business/economy/irs-debt-collection.html,803
News,2018-01-10,"President Trump on Wednesday repeated a pledge to make it easier for people to sue news organizations and publishers for defamation, denouncing the country’s libel laws as a “sham” a day after his personal lawyer filed a lawsuit against a major media outlet, BuzzFeed News.",https://www.nytimes.com/2018/01/10/business/media/trump-libel-laws.html,870
News,2018-01-10,"WASHINGTON — The Federal Reserve’s economic stimulus campaign continued to generate large profits in 2017, helping to reduce the federal deficit, but the windfall is showing signs of tapering.",https://www.nytimes.com/2018/01/10/business/fed-profits-treasury-2017.html,620
News,2018-01-10,It started with a tweet on Tuesday afternoon.,https://www.nytimes.com/2018/01/10/business/media/a-feminist-twitter-campaign-targets-harpers-magazine-and-katie-roiphe.html,1390
News,2018-01-10,"Five months after announcing that they would reward some American city with a $1.6 billion car plant and 4,000 jobs, Toyota Motor and Mazda Motor said on Wednesday that they had a winner: Huntsville, Ala.",https://www.nytimes.com/2018/01/10/business/toyota-mazda-plant-alabama.html,895
