atype,date,lead_par,url,word_count,article_text
News,2018-09-28,"At the breakfast buffet of Borgo Egnazia, a high-end resort in Fasano on Italy’s eastern coast, there’s a carafe of a substance unlikely to be found at any similarly luxurious hotel elsewhere in the world: siero di latte e cacao, or milk serum and cocoa. It looks like hot chocolate but tastes like seaweed, pungent enough that it might trigger the gag reflex of a consumer more accustomed to starting the morning with something from Starbucks. A centuries-old breakfast staple in this part of the world, the drink is essentially a protein shake made with the whey that remains after milk has been curdled and strained.",https://www.nytimes.com/2018/09/28/business/sd-hotels-luxury.html,1061,
News,2018-09-28,Good Friday. Want this in your inbox every morning? Sign up here.,https://www.nytimes.com/2018/09/28/business/dealbook/elon-musk-tesla-sec.html,1527,
News,2018-09-28, Get the DealBook newsletter to make sense of major business and policy headlines — and the power-brokers who shape them.__________,https://www.nytimes.com/2018/09/28/business/dealbook/elon-musk-tesla-stock.html,293,
News,2018-09-28,Get the DealBook newsletter to make sense of major business and policy headlines — and the power-brokers who shape them.__________,https://www.nytimes.com/2018/09/28/business/dealbook/tesla-stock-elon-musk.html,771,
News,2018-09-28,"BEIJING — China has long made it clear that reporting on politics, civil society and sensitive historical events is forbidden. Increasingly, it wants to keep negative news about the economy under control, too.",https://www.nytimes.com/2018/09/28/business/china-censor-economic-news.html,966,
News,2018-09-28,"The Securities and Exchange Commission has accused Elon Musk, Tesla’s chief executive, of committing fraud when he said on Twitter: “Am considering taking Tesla private at $420. Funding secured.” The S.E.C. says Mr. Musk had not had specific conversations about financing when he made that announcement, and so his tweet amounted to a false public statement with the potential to harm investors. It is seeking to prevent Mr. Musk from ever serving as an officer or director of a public company again, which is the most serious penalty the regulator can seek. (Criminal charges, if any, would be brought by the Department of Justice in a separate case.)",https://www.nytimes.com/2018/09/28/business/elon-musk-tesla-sec-ban.html,634,
News,2018-09-28,Getting more low-income students into elite colleges like Harvard and Stanford is an important goal. But it can’t replace race-based affirmative action.,https://www.nytimes.com/2018/09/28/business/at-elite-colleges-racial-diversity-requires-affirmative-action.html,1108,
News,2018-09-28, Get the DealBook newsletter to make sense of major business and policy headlines — and the power-brokers who shape them.__________,https://www.nytimes.com/2018/09/28/business/dealbook/worldquant-quants-talent.html,381,
News,2018-09-28,Apple’s new offerings are so good that I’m not buying a new iPhone.,https://www.nytimes.com/2018/09/28/business/apple-old-iphone-operating-system.html,1216,
News,2018-09-28,"Jay Browder, 43, is a machine operator at Alphapointe in Kansas City, Mo.",https://www.nytimes.com/2018/09/28/business/blind-machine-operator.html,591,
News,2018-09-29,"When Thursday began, Elon Musk had a deal on the table.",https://www.nytimes.com/2018/09/28/business/elon-musk-tesla-sec-deal.html,1394,
News,2018-09-29,"TOKYO — When Hiromi Otsuzuki joined the Japanese software company Isana.net as human resources manager four years ago, she was the only part-time employee.",https://www.nytimes.com/2018/09/28/business/japan-work-jobs-women.html,1244,
News,2018-09-29,"DENVER — By nearly any measure, this city is booming. The unemployment rate is below 3 percent. There is so much construction that a local newspaper started a “crane watch” feature. Seemingly every week brings headlines about companies bringing high-paying jobs to the area.",https://www.nytimes.com/2018/09/29/business/economy/home-prices-housing-market-slowdown.html,1814,
News,2018-09-29,"Elon Musk, under pressure from his lawyers and investors of Tesla, the company he co-founded, reached a deal with the Securities and Exchange Commission on Saturday to resolve securities fraud charges. The settlement will force Mr. Musk to step aside as chairman for three years and pay a $20 million fine.",https://www.nytimes.com/2018/09/29/business/tesla-musk-sec-settlement.html,1127,
News,2018-09-30,Here’s what to expect in the week ahead:,https://www.nytimes.com/2018/09/30/business/first-day-for-goldmans-new-ceo-and-job-numbers-come-out.html,512,
News,2018-09-30,"GLENDALE, Calif. — A young actor with a bushy goatee, cast as a Satanist on a murder-mystery show called “Solve,” sat facing a camera on a stuffy, no-frills set in July. Six tenderfoot crew members stood sweating in the shadows nearby. One was staring at his iPhone’s stopwatch.",https://www.nytimes.com/2018/09/30/business/media/elisabeth-murdoch-vertical-networks.html,1341,
News,2018-09-30,"This penthouse apartment in Manhattan’s SoHo neighborhood is awash in natural light, with high ceilings, gleaming hardwood floors and a rooftop deck. The living room area includes a sofa in the rosy hue known as millennial pink, the kitchen comes equipped with a floor-to-ceiling wine fridge, and the library nook is filled with books chosen for their appearance, not their contents. The white walls are spotless, and there is never any clutter.",https://www.nytimes.com/2018/09/30/business/media/instagram-influencers-penthouse.html,1246,
News,2018-09-30,ISTANBUL — A group of residents have been protesting for more than 70 days at an empty building site in eastern Istanbul. ,https://www.nytimes.com/2018/09/30/business/turkey-economy-development-protests.html,974,
News,2018-09-30,"BEIJING — Well before dawn, nearly a hundred people stood in line outside one of the capital’s top hospitals.",https://www.nytimes.com/2018/09/30/business/china-health-care-doctors.html,2742,
News,2018-10-01,"Elon Musk was chastened by federal regulators on Saturday night, agreeing to step down as chairman of Tesla and to have his communications monitored.",https://www.nytimes.com/2018/09/30/business/elon-musk-tesla-whats-next.html,1412,
News,2018-10-01,California became the first state to require its publicly held corporations to include women on their boards after Gov. Jerry Brown signed a bill into law on Sunday.,https://www.nytimes.com/2018/09/30/business/women-corporate-boards-california.html,904,
News,2018-10-01,"Tax evasion is at the center of the criminal cases against two associates of the president, Paul Manafort and Michael D. Cohen. The sheer scale of their efforts to avoid paying the government has given rise to a head-scratching question: How were they able to cheat the Internal Revenue Service for so many years?",https://www.nytimes.com/2018/10/01/business/economy/irs-tax-fraud-audit.html,1484,
News,2018-10-01,Good Monday. Want this by email? Sign up here.,https://www.nytimes.com/2018/10/01/business/dealbook/elon-musk-tesla-sec.html,1806,
News,2018-10-01,"When John Flannery was named chief executive of General Electric last year, he said he would rethink the troubled business “with speed, urgency and no constraints.” In the next months, he sharply cut expenses and devised a plan to sell off large parts of the industrial giant.",https://www.nytimes.com/2018/10/01/business/ge-ceo-flannery-replaced.html,1092,
News,2018-10-01,Get the DealBook newsletter to make sense of major business and policy headlines — and the power-brokers who shape them.__________,https://www.nytimes.com/2018/10/01/business/dealbook/general-electric-john-flannery.html,421,
News,2018-10-01,"In November 2010, as the Federal Reserve embarked on its second round of bond buying, Omid Malekan uploaded to YouTube a cartoon called “Quantitative Easing Explained,” which was critical of the central bank’s response to the financial crisis. Within weeks, millions of people had viewed it. Here, nearly eight years later, he says that he got it largely wrong.",https://www.nytimes.com/2018/10/01/business/dealbook/bernank-financial-crisis.html,1368,
News,2018-10-01,Get the DealBook newsletter to make sense of major business and policy headlines — and the power-brokers who shape them.__________,https://www.nytimes.com/2018/10/01/business/dealbook/elon-musk-sec-settlement.html,952,
News,2018-10-01,"LAKE CHARLES, La. — The Calcasieu River ship channel is a fisherman’s paradise for speckled trout. It is also a vital thoroughfare for Venezuelan oil.",https://www.nytimes.com/2018/10/01/business/energy-environment/venezuela-citgo-oil-sanctions.html,1240,
News,2018-10-01,"There’s a lot to digest in the new trade agreement that the United States, Mexico and Canada finalized in deadline-beating fashion on Sunday, starting with a name change: If the new deal is adopted by all three countries, the North American Free Trade Agreement will give way to the United States-Mexico-Canada Agreement or U.S.M.C.A. ",https://www.nytimes.com/2018/10/01/business/trump-nafta-usmca-differences.html,1004,
News,2018-10-02,"For years, this column has highlighted the dearth of women on corporate boards and in executive positions. It has suggested all sorts of ways for investors and others to encourage — even force — more diversity on boards, and raised pointed questions about why there are so few women in those roles.",https://www.nytimes.com/2018/10/01/business/dealbook/women-corporate-boards-california.html,1116,
News,2018-10-02,"Elon Musk’s settlement of a securities-fraud case has removed a cloud over the company and its leader. But another remains: how its electric-car production is measuring up against Mr. Musk's ambitious forecasts, a matter that a federal regulator is still investigating. ",https://www.nytimes.com/2018/10/01/business/tesla-cars-questions.html,1344,
News,2018-10-02,Good Tuesday. Want this by email? Sign up here.,https://www.nytimes.com/2018/10/02/business/dealbook/board-equality-california.html,1728,
News,2018-10-02,"SEATTLE — Amazon said on Tuesday that it would raise the minimum wage to $15 an hour for its United States employees, a rare acknowledgment that it was feeling squeezed by political pressure and a tight labor market. The raises apply for part-time workers and those hired through temporary agencies.",https://www.nytimes.com/2018/10/02/business/amazon-minimum-wage.html,1462,
News,2018-10-02,Get the DealBook newsletter to make sense of major business and policy headlines — and the power-brokers who shape them.__________,https://www.nytimes.com/2018/10/02/business/dealbook/amazon-wage-hike.html,382,
News,2018-10-02,Get the DealBook newsletter to make sense of major business and policy headlines — and the power-brokers who shape them.__________,https://www.nytimes.com/2018/10/02/business/dealbook/fresenius-akorn-delaware.html,396,
News,2018-10-02,"Over the last two months, Tesla has faced no shortage of distractions.",https://www.nytimes.com/2018/10/02/business/tesla-production.html,890,
News,2018-10-02,"BOSTON — Jerome H. Powell, the Federal Reserve chairman, said Tuesday that the American economy is enjoying an unusual but sustainable period of low unemployment and low inflation. He described the current moment, and the Fed’s expectation that it will continue, as “not too good to be true.”",https://www.nytimes.com/2018/10/02/business/jerome-powell-fed-economic-outlook.html,869,
News,2018-10-02,"Primera Air, a small low-cost airline that spent the last year expanding its reach from northern Europe to hubs in North America, filed for bankruptcy and ceased flying on Monday night, leaving passengers stranded at airports on both sides of the Atlantic.",https://www.nytimes.com/2018/10/02/business/primera-air-collapse.html,678,
News,2018-10-02,"Kieran O’Dea rises at 5 a.m. to begin his daily routine, shuffling to his desk to eye his portfolio: a cluster of biotechnology stocks and a bet that Tesla will go bust.",https://www.nytimes.com/2018/10/02/business/real-vision-hedge-fund-video.html,1432,
News,2018-10-03,"STOCKTON-ON-TEES, England — This once-booming County Durham market town in the northeast corner of England has something of a grand past. Known for a time as the Queen of the North, Stockton was the departure point in 1825 for the world’s first public passenger railway.",https://www.nytimes.com/2018/10/02/business/marks-spencer-faded-glory.html,1503,
Interactive Feature,2018-10-03,"A map of the counties targeted by China, Mexico, Canada and the European Union in a trade war looks strikingly similar to a map of the 2016 presidential election.",https://www.nytimes.com/interactive/2018/10/03/business/economy/china-tariff-retaliation.html,0,
News,2018-10-03,Good Wednesday. Want this by email? Sign up here.,https://www.nytimes.com/2018/10/03/business/dealbook/trump-father-riches.html,1606,
News,2018-10-03,"In the race to develop self-driving cars, General Motors has picked up another hefty ally.",https://www.nytimes.com/2018/10/03/business/honda-gm-cruise-autonomous.html,751,
News,2018-10-03,Get the DealBook newsletter to make sense of major business and policy headlines — and the power-brokers who shape them.__________,https://www.nytimes.com/2018/10/03/business/dealbook/aston-martin-ipo.html,327,
News,2018-10-03,Get the DealBook newsletter to make sense of major business and policy headlines — and the power-brokers who shape them.__________,https://www.nytimes.com/2018/10/03/business/dealbook/italy-5g-auction.html,402,
News,2018-10-03,"Backed by one of the nation’s biggest unions, nine teachers filed a lawsuit on Wednesday accusing the student loan servicer Navient of negligently blocking their access to a troubled federal loan forgiveness program for public service workers, adding thousands of extra dollars to their debts.",https://www.nytimes.com/2018/10/03/business/student-loan-forgiveness-lawsuit.html,998,
News,2018-10-03,"Pret A Manger, the British sandwich chain that has become a mainstay of office lunches with the promise of freshly prepared food, will be adding information about allergens in its food after the death of a girl who ate a sandwich containing sesame seeds, an ingredient she was allergic to.",https://www.nytimes.com/2018/10/03/business/pret-a-manager-allergy-labels.html,741,
News,2018-10-03,"HONG KONG — The comments were couched in careful language, but the warning about China’s direction was clear.",https://www.nytimes.com/2018/10/03/business/china-economy-private-enterprise.html,1431,
News,2018-10-03,Congress approved legislation on Wednesday that reauthorizes the Federal Aviation Administration for five years.,https://www.nytimes.com/2018/10/03/business/faa-congress-reauthorization.html,756,
News,2018-10-04,"PARIS — As President Emmanuel Macron presses ahead with the most business-friendly overhaul of the French labor market in decades, his popularity with many of his countrymen has gone into a tailspin. Consumer confidence is falling. A nascent recovery is cooling off. Unemployment has been stuck above 9 percent for months.",https://www.nytimes.com/2018/10/04/business/economy/mcaron-popularity-tax-cuts-working-class.html,1255,
News,2018-10-04,Good Thursday. Want this by email? Sign up here.,https://www.nytimes.com/2018/10/04/business/dealbook/dealbook-conference-lineup.html,1760,
News,2018-10-04,Get the DealBook newsletter to make sense of major business and policy headlines — and the power-brokers who shape them.__________,https://www.nytimes.com/2018/10/04/business/dealbook/smaller-mergers-banks.html,355,
News,2018-10-04,"HONG KONG — The mysterious Chinese oil company known as CEFC China raised eyebrows wherever it went. Its executives hinted at deep connections within Beijing’s halls of power as well as with China’s powerful military. Then, last year, prosecutors in the United States arrested one of its top executives, accusing him of bribery in an effort to secure oil rights in Chad and Uganda. Now, they say, he also explored businesses beyond oil: brokering arms deals in other countries and looking for ways to dodge American sanctions on Iran.",https://www.nytimes.com/2018/10/04/business/cefc-china-weapons-iran.html,1288,
News,2018-10-04,"COPENHAGEN — Danske Bank, which last month acknowledged failing to prevent suspected money laundering at its Estonian branch, has now drawn the attention of United States authorities.",https://www.nytimes.com/2018/10/04/business/danske-bank-us-investigation.html,447,
News,2018-10-04,Get the DealBook newsletter to make sense of major business and policy headlines — and the power-brokers who shape them.__________,https://www.nytimes.com/2018/10/04/business/dealbook/barnes-noble-stock.html,346,
News,2018-10-04,Get the DealBook newsletter to make sense of major business and policy headlines — and the power-brokers who shape them.__________,https://www.nytimes.com/2018/10/04/business/dealbook/europe-ipo.html,442,
News,2018-10-04,"Stanford University’s endowment, the world’s third largest, grew 11.3 percent in the most recent fiscal year, officials said this week.",https://www.nytimes.com/2018/10/04/business/stanford-endowment-gain.html,433,
News,2018-10-04,"Elon Musk can’t say he did anything wrong, but he can let you know how he feels about the Securities and Exchange Commission.",https://www.nytimes.com/2018/10/04/business/elon-musk-sec-tweet.html,556,
News,2018-10-05, Get the DealBook newsletter to make sense of major business and policy headlines — and the power-brokers who shape them.__________,https://www.nytimes.com/2018/10/04/business/dealbook/iran-sanctions-europe.html,1266,
News,2018-10-05,"LONDON — Unilever, the consumer products giant, has given up on plans to close its London headquarters, bowing to shareholder criticism of a move to simplify its corporate structure.",https://www.nytimes.com/2018/10/05/business/unilever-london-headquarters.html,429,
News,2018-10-05,"The unemployment rate fell to a nearly five-decade low in September, punctuating a remarkable rebound in the 10 years since the collapse of Lehman Brothers set off a global financial crisis.",https://www.nytimes.com/2018/10/05/business/economy/jobs-report.html,1446,
News,2018-10-05,"As large as it is, the building would be easy to miss. Plain, gray and near a McDonald’s, it’s part of a generic office complex surrounded by a vast parking lot in a suburb of Copenhagen. “Danish Tax Agency” is stenciled in both English and Danish on a glass front door.",https://www.nytimes.com/2018/10/05/business/denmark-skat-tax-scandal.html,3495,
News,2018-10-05,"Eileen Fisher, the woman, is not chief executive of Eileen Fisher, the company.",https://www.nytimes.com/2018/10/05/business/eileen-fisher-corner-office.html,1528,
News,2018-10-05,Good Friday. Want this by email Sign up here.,https://www.nytimes.com/2018/10/05/business/dealbook/china-chip-spying.html,1630,
News,2018-10-05,Get the DealBook newsletter to make sense of major business and policy headlines — and the power-brokers who shape them.__________,https://www.nytimes.com/2018/10/05/business/dealbook/investors-cyber-risk.html,369,
News,2018-10-05,"It was a balmy August morning in Santa Monica, Calif., and the city bus barreling down Olympic Boulevard toward the Pacific Ocean was packed. High school students crowded almost every seat, sandwiched in between a handful of actors and a movie director on a ride to nowhere.",https://www.nytimes.com/2018/10/05/business/ghetto-film-school-diversity.html,2484,
News,2018-10-05,"SHANHUI, China — This village doesn’t change quickly. The ebb and flow of the planting and harvesting seasons still govern the lives of its 3,000 residents. Some rise at 3 a.m. to cook homemade tofu, a Shanhui specialty, over a coal-burning stove. Most homes remain topped by traditional Chinese tiled roofs, here crowned by carved dragon’s heads, as is local custom.",https://www.nytimes.com/2018/10/05/business/china-small-farms-urbanization.html,1213,
News,2018-10-05,"Laurie Scherrer was a workaholic sales executive when she began forgetting customers and losing her ability to perform simple math calculations. Five years ago, at age 55, she learned she has early-onset Alzheimer’s disease and frontotemporal dementia.",https://www.nytimes.com/2018/10/05/business/-active-life-diagnosis-of-dementia.html,1511,
News,2018-10-06,"In the 30 years he’s worked at Alaska Airlines, Ray Prentice has never actually heard of a miniature horse boarding one of its flights.",https://www.nytimes.com/2018/10/06/business/alaska-airlines-horses.html,793,
News,2018-10-07,HONG KONG — China is signaling that it is worried about its economy.,https://www.nytimes.com/2018/10/07/business/china-lending-trade-war.html,1071,
News,2018-10-07,Pret A Manger has acknowledged that a second customer died after an allergic reaction to food sold at the popular British sandwich chain.,https://www.nytimes.com/2018/10/07/business/uk-pret-a-manger-allergy.html,290,
News,2018-10-07,Here’s what to expect in the week ahead:,https://www.nytimes.com/2018/10/07/business/nobel-in-economics-to-be-awarded-and-big-banks-begin-reporting-earnings.html,440,
News,2018-10-07,"In the final months of President Obama’s administration, the government’s top consumer regulator was negotiating a large settlement with the student loan collector Navient, which it said had misled borrowers and made mistakes that added billions of dollars to their bills.",https://www.nytimes.com/2018/10/07/business/student-loans-navient.html,1350,
News,2018-10-07,"Qualcomm, the American chip maker, spent two years hammering out a $44 billion deal to acquire a Dutch semiconductor manufacturer. Then, as the trade war with the United States erupted, Chinese regulators effectively killed it.",https://www.nytimes.com/2018/10/07/business/china-trade-deals-retaliate.html,1047,
